Exchange,Symbol,Shortname,Longname,Sector,Industry,Currentprice,Marketcap,Ebitda,Revenuegrowth,City,State,Country,Fulltimeemployees,Longbusinesssummary,Weight
NMS,HON,Honeywell International Inc.,Honeywell International Inc.,Industrials,Conglomerates,228.32,148464402432,9164000256,0.056,Charlotte,NC,United States,95000,"Honeywell International Inc. engages in the aerospace technologies, building automation, energy and sustainable solutions, and industrial automation businesses in the United States, Europe, and internationally. The company's Aerospace segment offers auxiliary power units, propulsion engines, integrated avionics, environmental control and electric power systems, engine controls, flight safety, communications, navigation hardware, data and software applications, radar and surveillance systems, aircraft lighting, advanced systems and instruments, satellite and space components, and aircraft wheels and brakes; spare parts; repair, overhaul, and maintenance services; and thermal systems, as well as wireless connectivity services. Its Honeywell Building Technologies segment provides software applications for building control and optimization; sensors, switches, control systems, and instruments for energy management; access control; video surveillance; fire products; and installation, maintenance, and upgrades of systems. The company's Performance Materials and Technologies segment offers automation control, instrumentation, and software and related services; catalysts and adsorbents, equipment, and consulting; and materials to manufacture end products, such as bullet-resistant armor, nylon, computer chips, and pharmaceutical packaging, as well as provides materials based on hydrofluoro-olefin technology. Its Safety and Productivity Solutions segment provides personal protective equipment, apparel, gear, and footwear; gas detection technology; custom-engineered sensors, switches, and controls for sensing and productivity solution; cloud-based notification and emergency messaging; mobile devices and software; custom-engineered sensors, switches, and controls; and data and asset management productivity solutions. Honeywell International Inc. was founded in 1885 and is headquartered in Charlotte, North Carolina.",0.002671062325423253
NYQ,NEE,"NextEra Energy, Inc.","NextEra Energy, Inc.",Utilities,Utilities - Regulated Electric,71.67,147382190080,14577999872,0.055,Juno Beach,FL,United States,16800,"NextEra Energy, Inc., through its subsidiaries, generates, transmits, distributes, and sells electric power to retail and wholesale customers in North America. The company generates electricity through wind, solar, nuclear,natural gas, and other clean energy. It also develops, constructs, and operates long-term contracted assets that consists of clean energy solutions, such as renewable generation facilities, battery storage projects, and electric transmission facilities; sells energy commodities; and owns, develops, constructs, manages and operates electric generation facilities in wholesale energy markets. The company had approximately 33,276 megawatts of net generating capacity; approximately 90,000 circuit miles of transmission and distribution lines; and 883 substations. It serves approximately 12 million people through approximately 5.9 million customer accounts in the east and lower west coasts of Florida. The company was formerly known as FPL Group, Inc. and changed its name to NextEra Energy, Inc. in 2010. NextEra Energy, Inc. was founded in 1925 and is headquartered in Juno Beach, Florida.",0.0026515919568084003
NMS,CMCSA,Comcast Corporation,Comcast Corporation,Communication Services,Telecom Services,38.22,146250366976,37285998592,0.065,Philadelphia,PA,United States,186000,"Comcast Corporation operates as a media and technology company worldwide. It operates through Residential Connectivity & Platforms, Business Services Connectivity, Media, Studios, and Theme Parks segments. The Residential Connectivity & Platforms segment provides residential broadband and wireless connectivity services, residential and business video services, sky-branded entertainment television networks, and advertising. The Business Services Connectivity segment offers connectivity services for small business locations, which include broadband, wireline voice, and wireless services, as well as solutions for medium-sized customers and larger enterprises; and small business connectivity services in the United Kingdom. The Media segment operates NBCUniversal's television and streaming business, including national and regional cable networks; the NBC and Telemundo broadcast networks and owned local broadcast television stations; and Peacock, a direct-to-consumer streaming services. It also operates international television networks comprising the Sky Sports networks, as well as other digital properties. The Studios segment operates NBCUniversal and Sky film and television studio production and distribution operations. The Theme Parks segment operates Universal theme parks in Orlando, Florida; Hollywood, California; Osaka, Japan; and Beijing, China. The company also offers a consolidated streaming platforms under the Philadelphia Flyers and the Wells Fargo Center arena in Philadelphia, Pennsylvania; and Xumo. Comcast Corporation was founded in 1963 and is headquartered in Philadelphia, Pennsylvania.",0.0026312290280347994
NYQ,ANET,"Arista Networks, Inc.",Arista Networks Inc,Technology,Computer Hardware,112.81,142113521664,2833341952,0.2,Santa Clara,CA,United States,4023,"Arista Networks Inc engages in the development, marketing, and sale of data-driven, client to cloud networking solutions for data center, campus, and routing environments in the Americas, Europe, the Middle East, Africa, and the Asia-Pacific. Its cloud networking solutions consist of Extensible Operating System (EOS), a publish-subscribe state-sharing networking operating system offered in combination with a set of network applications. The company offers data center and cloud networking systems, including newer artificial intelligence (AI) ethernet switching platforms; campus wired and wireless products, and routing systems addressing Core Routing, Edge Routing, Data Center Interconnect (DCI), Multi-cloud and Wide Area Networking (WAN) use cases; and a suite of value-add software solutions that leverage EOS to provide end-to-end orchestration, automation, analytics, network monitoring, and security. It also provides post contract customer support services, such as technical support, hardware repair and replacement parts beyond standard warranty, bug fixes, patches, and upgrade services. The company serves a range of industries comprising internet companies, service providers, financial services organizations, government agencies, media and entertainment companies, telecommunication service providers, and others. It markets and sells its products through distributors, system integrators, value-added resellers, and original equipment manufacturer partners, as well as through its direct sales force. The company was formerly known as Arastra, Inc. and changed its name to Arista Networks Inc in October 2008. Arista Networks Inc was incorporated in 2004 and is headquartered in Santa Clara, California.",0.002556801950041824
NMS,AMGN,Amgen Inc.,Amgen Inc.,Healthcare,Drug Manufacturers - General,263.38,141575438336,12247000064,0.232,Thousand Oaks,CA,United States,26700,"Amgen Inc. discovers, develops, manufactures, and delivers human therapeutics worldwide. The company's principal products include Enbrel to treat plaque psoriasis, rheumatoid arthritis, and psoriatic arthritis; Otezla for the treatment of adult patients with plaque psoriasis, psoriatic arthritis, and oral ulcers associated with Behçet's disease; Prolia to treat postmenopausal women with osteoporosis; XGEVA for skeletal-related events prevention; Repatha, which reduces the risks of myocardial infarction, stroke, and coronary revascularization; Nplate for the treatment of patients with immune thrombocytopenia; KYPROLIS to treat patients with relapsed or refractory multiple myeloma; Aranesp to treat a lower-than-normal number of red blood cells and anemia; EVENITY for the treatment of osteoporosis in postmenopausal for men and women; Vectibix to treat patients with wild-type RAS metastatic colorectal cancer; BLINCYTO for the treatment of patients with acute lymphoblastic leukemia; TEPEZZA to treat thyroid eye disease; and KRYSTEXXA for the treatment of chronic refractory gout. It also markets other products, including Neulasta, MVASI, AMJEVITA/AMGEVITA, TEZSPIRE, Parsabiv, Aimovig, LUMAKRAS/LUMYKRAS, EPOGEN, KANJINTI, TAVNEOS, RAVICTI, UPLIZNA and PROCYSBI. The company serves healthcare providers, including physicians or their clinics, dialysis centers, hospitals, and pharmacies. It distributes its products through pharmaceutical wholesale distributors, as well as direct-to-consumer channels. The company has collaboration agreements with AstraZeneca plc for the development and commercialization of TEZSPIRE; Novartis Pharma AG to develop and commercialize Aimovig; UCB for the development and commercialization of EVENITY; Kyowa Kirin Co., Ltd. for rocatinlimab development and commercialization; and BeiGene, Ltd. for oncology products expansion and development. Amgen Inc. was incorporated in 1980 and is headquartered in Thousand Oaks, California.",0.002547121150592155
NYQ,PGR,Progressive Corporation (The),The Progressive Corporation,Financial Services,Insurance - Property & Casualty,239.97,140577062912,10823199744,0.267,Mayfield Village,OH,United States,61432,"The Progressive Corporation, an insurance holding company, provides personal and commercial auto, personal residential and commercial property, business related general liability, and other specialty property-casualty insurance products and related services in the United States. It operates in three segments: Personal Lines, Commercial Lines, and Property. The Personal Lines segment writes insurance for personal autos and recreational vehicles (RV). This segment's products include personal auto insurance; and special lines products, including insurance for motorcycles, ATVs, RVs, watercrafts, snowmobiles, and related products. The Commercial Lines segment provides auto-related liability and physical damage insurance, and business-related general liability and property insurance for autos, vans, and pick-up trucks used by small businesses, as well as non-fleet taxis, black-car services, and airport taxis; tractors, trailers, and straight trucks primarily used by regional general freight and expeditor-type businesses, and long-haul operators; dump trucks used by light contractors and heavy constructions; log trucks and garbage trucks used by dirt, sand and gravel, logging, garbage/debris removal, and coal-type businesses; and tow trucks and wreckers used in towing services and gas/service station businesses. The Property segment writes residential property insurance for homeowners, other property owners, and renters, as well as offers manufactured homes, personal umbrella insurance, and primary and excess flood insurance. The company offers policy issuance and claims adjusting services; acts as an agent to homeowners, general liability, workers' compensation insurance, and other products; and reinsurance services. It sells its products through independent insurance agencies, as well as through mobile applications and over the phone. The Progressive Corporation was founded in 1937 and is headquartered in Mayfield Village, Ohio.",0.002529159114319545
NYQ,LOW,"Lowe's Companies, Inc.","Lowe's Companies, Inc.",Consumer Cyclical,Home Improvement Retail,247.72,139875090432,12433000448,-0.055,Mooresville,NC,United States,300000,"Lowe's Companies, Inc., together with its subsidiaries, operates as a home improvement retailer in the United States. The company offers a line of products for construction, maintenance, repair, remodeling, and decorating. It also provides home improvement products, such as appliances, seasonal and outdoor living, lawn and garden, lumber, kitchens and bath, tools, paint, millwork, hardware, flooring, rough plumbing, building materials, décor, and electrical. In addition, the company offers installation services through independent contractors in various product categories; and extended protection plans and repair services. It sells its national brand-name merchandise and private brand products to professional customers, homeowners, renters, businesses, and government. The company also sells its products through Lowes.com website; and through mobile applications. Lowe's Companies, Inc. was founded in 1921 and is based in Mooresville, North Carolina.",0.0025165297417959146
NYQ,SYK,Stryker Corporation,Stryker Corporation,Healthcare,Medical Devices,364.6,138991353856,5693000192,0.119,Portage,MI,United States,52000,"Stryker Corporation operates as a medical technology company. The company operates through two segments, MedSurg and Neurotechnology, and Orthopaedics and Spine. The Orthopaedics and Spine segment provides implants for use in total joint replacements, such as hip, knee and shoulder, and trauma and extremities surgeries. This segment also offers spinal implant products comprising cervical and thoracolumbar systems that include fixation, minimally invasive and interbody systems used in spinal injury, complex spine and degenerative therapies. The MedSurg and Neurotechnology segment offers surgical equipment, and surgical navigation systems, endoscopic and communications systems, patient handling, emergency medical equipment and intensive care disposable products, reprocessed and remanufactured medical devices, clinical communication and workflow solutions, and other medical device products that are used in various medical specialties, as well as patient and caregiver safety technologies. This segment also provides neurosurgical, neurovascular and craniomaxillofacial implant products, which include products used for minimally invasive endovascular procedures; products for brain and open skull based surgical procedures; orthobiologic and biosurgery products, such as synthetic bone grafts and vertebral augmentation products; minimally invasive products for the treatment of acute ischemic and hemorrhagic stroke; and craniomaxillofacial implant products, including cranial, maxillofacial, and chest wall devices, as well as dural substitutes and sealants. The company sells its products to doctors, hospitals, and other healthcare facilities through company-owned subsidiaries and branches, as well as third-party dealers and distributors in approximately 75 countries. Stryker Corporation was founded in 1941 and is headquartered in Portage, Michigan.",0.002500630203353807
NYQ,UNP,Union Pacific Corporation,Union Pacific Corporation,Industrials,Railroads,226.32,137208094720,12030000128,0.025,Omaha,NE,United States,30518,"Union Pacific Corporation, through its subsidiary, Union Pacific Railroad Company, operates in the railroad business in the United States. The company offers transportation services for grain and grain products, fertilizers, food and refrigerated products, and coal and renewables to grain processors, animal feeders, ethanol producers, renewable biofuel producers, and other agricultural users; and construction products, industrial chemicals, plastics, forest products, specialized products, metals and ores, petroleum, liquid petroleum gases, soda ash, and sand, as well as finished automobiles, automotive parts, and merchandise in intermodal containers. Union Pacific Corporation was founded in 1862 and is headquartered in Omaha, Nebraska.",0.002468547116656859
NYQ,TJX,"TJX Companies, Inc. (The)","The TJX Companies, Inc.",Consumer Cyclical,Apparel Retail,122.0,137147523072,7125000192,0.056,Framingham,MA,United States,349000,"The TJX Companies, Inc., together with its subsidiaries, operates as an off-price apparel and home fashions retailer in the United States, Canada, Europe, and Australia. It operates through four segments: Marmaxx, HomeGoods, TJX Canada, and TJX International. The company sells family apparel, including footwear and accessories; home fashions, such as home basics, furniture, rugs, lighting products, giftware, soft home products, decorative accessories, tabletop, and cookware, as well as expanded pet, and gourmet food departments; jewelry and accessories; and other merchandise. It offers its products through stores and e-commerce sites. The TJX Companies, Inc. was incorporated in 1962 and is headquartered in Framingham, Massachusetts.",0.0024674573561195767
NYQ,KKR,KKR & Co. Inc.,KKR & Co. Inc.,Financial Services,Asset Management,147.58,136186535936,,0.238,New York,NY,United States,4490,"KKR & Co. Inc. is a private equity and real estate investment firm specializing in direct and fund of fund investments. It specializes in acquisitions, leveraged buyouts, management buyouts, credit special situations, growth equity, mature, mezzanine, distressed, turnaround, lower middle market, and middle market investments. The firm considers investments in all industries with a focus on software, security, semiconductors, consumer electronics, internet of things (iot), internet, information services, information technology infrastructure, financial technology, network and cyber security architecture, engineering and operations, content, technology and hardware, energy and infrastructure, real estate, services industry with a focus on business services, intelligence, industry-leading franchises and companies in natural resource, containers and packaging, agriculture, airports, ports, forestry, electric utilities, textiles, apparel and luxury goods, household durables, digital media, insurance, brokerage houses, non-durable goods distribution, supermarket retailing, grocery stores, food, beverage, and tobacco, hospitals, entertainment venues and production companies, publishing, printing services, capital goods, financial services, specialized finance, pipelines, and renewable energy. In energy and infrastructure, it focuses on the upstream oil and gas and equipment, minerals and royalties and services verticals. In real estate, the firm seeks to invest in private and public real estate securities including property-level equity, debt and special situations transactions and businesses with significant real estate holdings, and oil and natural gas properties. The firm also invests in asset services sector that encompasses a broad array of B2B, B2C and B2G services verticals including asset-based, transport, logistics, leisure/hospitality, resource and utility support, infra-like, mission-critical, and environmental services. Within Americas, the firm prefers to invest in consumer products; chemicals, metals and mining; energy and natural resources; financial services; healthcare; industrials; media and communications; retail; and technology. Within Europe, the firm invests in consumer and retail; energy; financial services; health care; industrials and chemicals; media and digital; and telecom and technologies. Within Asia, it invests in consumer products; energy and resources; financial services; healthcare; industrials; logistics; media and telecom; retail; real estate; and technology. It also seeks to make impact investments focused on identifying and investing behind businesses with positive social or environmental impact. The firm seeks to invest in mid to high-end residential developments but can invest in other projects throughout Mainland China through outright ownership, joint ventures, and merger. It invests globally with a focus on Australia, emerging and developed Asia, Middle East and Africa, Nordic, Southeast Asia, Asia Pacific, Ireland, Hong Kong, Japan, Taiwan, India, Vietnam, Malaysia, Singapore, Indonesia, France, Germany, Netherlands, United Kingdom, Caribbean, Mexico, South America, North America, Brazil, Latin America, Korea with a focus on South Korea, and United States of America. In the United States and Europe, the firm focuses on buyouts of large, publicly traded companies. For middle market it seeks to invest in companies with enterprise values between $200 million to $1000 million. The firm prefers to invest in a range of debt and public equity investing and may co-invest. It seeks a board seat in its portfolio companies and a controlling ownership of a company or a strategic minority position. The firm may acquire majority and minority equity interests, particularly when making private equity investments in Asia or sponsoring investments as part of a large investor consortium. The firm typically holds its investment for a period of five to seven years and more and exits through initial public offerings, secondary offerings, and sales to strategic buyers. KKR & Co. Inc. was founded in 1976 and is based in New York, New York with additional offices across North America, Europe, Australia and Asia.",0.0024501679824236724
NYQ,SCHW,Charles Schwab Corporation (The,The Charles Schwab Corporation,Financial Services,Capital Markets,74.31,136028905472,,0.052,Westlake,TX,United States,32100,"The Charles Schwab Corporation, together with its subsidiaries, operates as a savings and loan holding company that provides wealth management, securities brokerage, banking, asset management, custody, and financial advisory services in the United States and internationally. The company operates in two segments, Investor Services and Advisor Services. It offers brokerage accounts with equity and fixed income trading, margin lending, options trading, futures and forex trading, and cash management capabilities, including certificates of deposit; third-party mutual funds through the Mutual Fund Marketplace and Mutual Fund OneSource service, as well as mutual fund trading and clearing services to broker-dealers; exchange-traded funds; advisory solutions for managed portfolios, separately managed accounts, customized personal advice for tailored portfolios, specialized planning, and full-time portfolio management; banking products comprising checking and savings accounts, first lien residential real estate mortgage loans, home equity lines of credit, and pledged asset lines; and trust custody services, personal trust reporting services, and administrative trustee services. It also provides digital retirement calculators; integrated web-, mobile-, and software-based trading platforms, real-time market data, options trading, premium research, and multi-channel access; self-service education and support tools; online research and analysis tools; equity compensation plan sponsors full-service recordkeeping for stock plans, stock options, restricted stock, performance shares, and stock appreciation rights; retirement plan services; mutual fund clearing services; and advisor services, including interactive tools and educational content. The Company operates through branch offices. The Charles Schwab Corporation was founded in 1971 and is headquartered in Westlake, Texas.",0.002447332011060623
NYQ,ETN,"Eaton Corporation, PLC",Eaton Corporation plc,Industrials,Specialty Industrial Machinery,338.12,133625020416,5449999872,0.079,Dublin,,Ireland,94000,"Eaton Corporation plc operates as a power management company worldwide. The company's Electrical Americas and Electrical Global segment provides electrical components, industrial components, power distribution and assemblies, residential products, single and three phase power quality and connectivity products, wiring devices, circuit protection products, utility power distribution products, power reliability equipment, and services, as well as hazardous duty electrical equipment, emergency lighting, fire detection, explosion-proof instrumentation, and structural support systems. Its Aerospace segment offers pumps, motors, hydraulic power units, hoses and fittings, and electro-hydraulic pumps; valves, cylinders, electronic controls, electromechanical actuators, sensors, aircraft flap and slat systems, and nose wheel steering systems; hose, thermoplastic tubing products, fittings, adapters, couplings, and sealing and ducting products; air-to-air refueling systems, fuel pumps, fuel inerting products, sensors, and adapters and regulators; oxygen generation system, payload carriages, and thermal management products; and wiring connectors and cables, as well as hydraulic and bag filters, strainers and cartridges, and golf grips for manufacturers of commercial and military aircraft, and related after-market customers, as well as industrial applications. The company's Vehicle segment offers transmissions, clutches, hybrid power systems, superchargers, engine valves and valve actuation systems, locking and limited slip differentials, transmission controls, and fuel vapor components for the vehicle industry. Its eMobility segment provides voltage inverters, converters, fuses, circuit protection units, vehicle controls, power distribution systems, fuel tank isolation valves, and commercial vehicle hybrid systems. Eaton Corporation plc was founded in 1911 and is based in Dublin, Ireland.",0.0024040830793130245
