Exchange,Symbol,Shortname,Longname,Sector,Industry,Currentprice,Marketcap,Ebitda,Revenuegrowth,City,State,Country,Fulltimeemployees,Longbusinesssummary,Weight
NYQ,ITW,Illinois Tool Works Inc.,Illinois Tool Works Inc.,Industrials,Specialty Industrial Machinery,258.82,76429549568,4652000256,-0.016,Glenview,IL,United States,45000,"Illinois Tool Works Inc. manufactures and sells industrial products and equipment in the United States and internationally. It operates through seven segments: Automotive OEM; Food Equipment; Test & Measurement and Electronics; Welding; Polymers & Fluids; Construction Products; and Specialty Products. The Automotive OEM segment offers plastic and metal components, fasteners, and assemblies for automobiles, light trucks, and other industrial uses. The Food Equipment segment provides warewashing, refrigeration, cooking, and food processing equipment; kitchen exhaust, ventilation, and pollution control systems; and food equipment maintenance and repair services. The Test & Measurement and Electronics segment produces and sells equipment, consumables, and related software for testing and measuring of materials and structures, as well as equipment and consumables used in the production of electronic subassemblies and microelectronics. The Welding segment produces arc welding equipment; and metal arc welding consumables and related accessories. The Polymers & Fluids segment produces adhesives, sealants, lubrication and cutting fluids, and fluids and polymers for auto aftermarket maintenance and appearance. The Construction Products segment offers engineered fastening systems and solutions for the residential construction, renovation/remodel, and commercial construction markets. The Specialty Products segment provides beverage packaging equipment and consumables, product coding and marking equipment and consumables, and appliance components and fasteners. It serves the automotive OEM and tiers, MRO, commercial food equipment, construction, general industrial, industrial capital goods, consumer durables, automotive aftermarket end, and other markets. The company distributes its products directly to industrial manufacturers, as well as through independent distributors. Illinois Tool Works Inc. was founded in 1912 and is based in Glenview, Illinois.",0.0013750642379991274
NMS,SNPS,"Synopsys, Inc.","Synopsys, Inc.",Technology,Software - Infrastructure,492.18,76080201728,1652390016,0.127,Sunnyvale,CA,United States,20300,"Synopsys, Inc. provides electronic design automation software products used to design and test integrated circuits. It operates in three segments: Design Automation, Design IP, and Software Integrity. The company offers Digital and Custom IC Design solution that provides digital design implementation solutions; Verification solution that offers virtual prototyping, static and formal verification, simulation, emulation, field programmable gate array (FPGA)-based prototyping, and debug solutions; and FPGA design products that are programmed to perform specific functions. It also provides intellectual property (IP) solutions for USB, PCI Express, DDR, Ethernet, MIPI, HDMI, and Bluetooth low energy applications; logic libraries and embedded memories; processor cores, software, and application-specific instruction-set processor tools for embedded applications; security IP solutions; IP solutions for automotive market; and system-on-chip (SoC) infrastructure IP, datapath and building block IP, and verification IP products, as well as mathematical and floating-point components, and Arm AMBA interconnect fabric and peripherals. In addition, the company offers HAPS FPGA-based prototyping systems; virtual prototyping solutions; and Platform Architect solutions for SoC architecture analysis and optimization, as well as optical products, and mechatronic simulations. Further, it provides security and quality testing products, managed services, programs and professional services, and training that enable its customers to detect and remediate security vulnerabilities, and defects in the software development lifecycle, as well as manufacturing solutions. Additionally, the company provides intelligent orchestration solution, software risk manager, and black duck software composition analysis tools. It serves electronics, financial services, automotive, medicine, energy, and industrial areas. The company was incorporated in 1986 and is headquartered in Sunnyvale, California.",0.0013687790286249853
NMS,CTAS,Cintas Corporation,Cintas Corporation,Industrials,Specialty Business Services,186.94,75429543936,2450383872,0.068,Cincinnati,OH,United States,46500,"Cintas Corporation engages in the provision of corporate identity uniforms and related business services primarily in the United States, Canada, and Latin America. It operates through Uniform Rental and Facility Services, First Aid and Safety Services, and All Other segments. The company rents and services uniforms and other garments, including flame resistant clothing, mats, mops and shop towels, and other ancillary items; and provides restroom cleaning services and supplies, as well as sells uniforms. In addition, the company offers first aid and safety services, and fire protection products and services. It provides its products and services through its distribution network and local delivery routes, or local representatives to small service and manufacturing companies, as well as major corporations. The company was founded in 1968 and is based in Cincinnati, Ohio. Cintas Corporation was formerly a subsidiary of Cintas Corporation.",0.001357072872223283
NYQ,COF,Capital One Financial Corporati,Capital One Financial Corporation,Financial Services,Credit Services,178.65,68156760064,,0.064,McLean,VA,United States,52500,"Capital One Financial Corporation operates as the financial services holding company for the Capital One, National Association, which engages in the provision of various financial products and services in the United States, Canada, and the United Kingdom. It operates through three segments: Credit Card, Consumer Banking, and Commercial Banking. The company accepts checking accounts, money market deposits, negotiable order of withdrawals, savings deposits, and time deposits. Its loan products include credit card loans; auto and retail banking loans; and commercial and multifamily real estate, and commercial and industrial loans. The company also offers credit and debit card products; online direct banking services; and provides advisory, capital markets, treasury management, and depository services. It serves consumers, small businesses, and commercial clients through digital channels, branches, cafés, and other distribution channels located in New York, Louisiana, Texas, Maryland, Virginia, New Jersey, and California. The company was founded in 1988 and is headquartered in McLean, Virginia.",0.0012262262943013962
YQ,FDX,FedEx Corporation,FedEx Corporation,Industrials,Integrated Freight & Logistics,275.73,66409852928,10885000192,0.139,Memphis,TN,United States,306000,"FedEx Corporation, together with its subsidiaries, provides transportation, e-commerce, and business services in the United States and internationally. It operates through FedEx Express, FedEx Ground, FedEx Freight, and FedEx Services segments. The FedEx Express segment offers express transportation, small-package ground delivery, and freight transportation services; and time-critical transportation services. The FedEx Ground segment provides small-package ground delivery services. The FedEx Freight segment offers less-than-truckload freight transportation services. The FedEx Services segment provides sales, marketing, information technology, communications, customer service, technical support, billing and collection, and back-office support services. In addition, the company offers supply chain management solutions; and air and ocean freight forwarding and cargo transportation, specialty transportation, customs brokerage, third party logistics and supply chain, and document and business solutions, as well as provides trade management tools and data. The company was founded in 1971 and is headquartered in Memphis, Tennessee.",0.0011947972260496998
NYQ,SPG,"Simon Property Group, Inc.","Simon Property Group, Inc.",Real Estate,REIT - Retail,171.61,64434921472,4353110016,0.049,Indianapolis,IN,United States,2500,"Simon Property Group, Inc. (NYSE:SPG) is a self-administered and self-managed real estate investment trust (REIT). Simon Property Group, L.P., or the Operating Partnership, is our majority-owned partnership subsidiary that owns all of our real estate properties and other assets. In this package, the terms Simon, we, our, or the Company refer to Simon Property Group, Inc., the Operating Partnership, and its subsidiaries. We own, develop and manage premier shopping, dining, entertainment and mixed-use destinations, which consist primarily of malls, Premium Outlets, The Mills, and International Properties. At September 30, 2024, we owned or had an interest in 231 properties comprising 184 million square feet in North America, Asia and Europe. We also owned an 84% interest in The Taubman Realty Group, or TRG, which owns 22 regional, super-regional, and outlet malls in the U.S. and Asia. Additionally, at September 30, 2024, we had a 22.4% ownership interest in Klepierre, a publicly traded, Paris-based real estate company, which owns shopping centers in 14 European countries.",0.0011592657119560703
NMS,ADSK,"Autodesk, Inc.","Autodesk, Inc.",Technology,Software - Application,298.12,64247537664,1396000000,0.119,San Francisco,CA,United States,14100,"Autodesk, Inc. provides 3D design, engineering, and entertainment technology solutions worldwide. The company offers AutoCAD Civil 3D, a surveying, design, analysis, and documentation solution for land development, transportation, and environmental projects; Autodesk Build, provides a toolset for managing, sharing, and accessing project documents for streamlined workflows between the office, trailer, and jobsite; Revit, a software built for Building Information Modeling to help professionals design, build, and maintain higher-quality, more energy-efficient buildings; Autodesk BIM Collaborate Pro, cloud-based design collaboration and design management software; and BuildingConnected, a SaaS preconstruction solution. It also provides AutoCAD software, a customizable and extensible CAD application for professional design, drafting, detailing, and visualization; AutoCAD LT, a drafting and detailing software; Fusion, a 3D CAD, computer-aided manufacturing, and computer-aided engineering tool; Inventor, a software solution, that offers a set of tools for 3D mechanical design, simulation, analysis, tooling, visualization, and documentation; and Vault, a data management software, for managing data in one central location, accelerate design processes, and streamline internal/external collaboration. In addition, the company offers Flow Production Tracking, cloud-based software for review and production tracking; Maya software, which provides 3D modeling, animation, effects, rendering, and compositing solutions for film and video artists, game developers, and design visualization professionals; Media and Entertainment Collection, that provides end-to-end creative tools for entertainment creation; and 3ds Max software provides 3D modeling, animation, and rendering solutions. It sells its products and services to customers directly, as well as through a network of resellers and distributors. The company was incorporated in 1982 and is headquartered in San Francisco, California.",0.0011558944403128736
NYQ,RCL,Royal Caribbean Cruises Ltd.,Royal Caribbean Cruises Ltd.,Consumer Cyclical,Travel Services,238.43,64107868160,5641999872,0.175,Miami,FL,United States,98100,"Royal Caribbean Cruises Ltd. operates as a cruise company worldwide. The company operates cruises under the Royal Caribbean International, Celebrity Cruises, and Silversea Cruises brands, which comprise a range of itineraries. As of February 21, 2024, it operated 65 ships. Royal Caribbean Cruises Ltd. was founded in 1968 and is headquartered in Miami, Florida.",0.0011533816093309429
NYQ,RSG,"Republic Services, Inc.","Republic Services, Inc.",Industrials,Waste Management,203.73,63798456320,4804800000,0.065,Phoenix,AZ,United States,41000,"Republic Services, Inc., together with its subsidiaries, offers environmental services in the United States and Canada. It is involved in the collection and processing of recyclable, solid waste, and industrial waste materials; transportation and disposal of non-hazardous and hazardous waste streams; and other environmental solutions. Its residential collection services include curbside collection of material for transport to transfer stations, landfills, recycling centers, and organics processing facilities; supply of recycling and waste containers; and renting of compactors. The company also engages in the processing and sale of old corrugated containers, old newsprint, aluminum, glass, and other materials; and provision of landfill services. It serves small-container, large-container, and residential customers. The company was incorporated in 1996 and is based in Phoenix, Arizona.",0.001147814899093838
NYQ,HLT,Hilton Worldwide Holdings Inc.,Hilton Worldwide Holdings Inc.,Consumer Cyclical,Lodging,249.42,60803608576,2456999936,0.063,McLean,VA,United States,178000,"Hilton Worldwide Holdings Inc., a hospitality company, engages in managing, franchising, owning, and leasing hotels and resorts. It operates through two segments, Management and Franchise, and Ownership. The company engages in the hotel management and licensing of its brands. It operates luxury hotels under the Waldorf Astoria Hotels & Resorts, LXR Hotels & Resorts, and Conrad Hotels & Resorts brand; lifestyle hotels under the Canopy by Hilton, Curio Collection by Hilton, Tapestry Collection by Hilton, Tempo by Hilton, and Motto by Hilton brand; full service hotels under the Signia by Hilton, Hilton Hotels & Resorts, and DoubleTree by Hilton brand; service hotels under the Hilton Garden Inn, Hampton by Hilton, and Tru by Hilton brand; all-suite hotels under the Embassy Suites by Hilton, Homewood Suites by Hilton, and Home2 Suites by Hilton brand; and economy hotel under the Spark by Hilton brand, as well as Hilton Grand Vacations. The company operates in North America, South America, and Central America, including various Caribbean nations; Europe, the Middle East, and Africa; and the Asia Pacific. The company was founded in 1919 and is headquartered in McLean, Virginia.",0.0010939338013469142
NYQ,DLR,"Digital Realty Trust, Inc.","Digital Realty Trust, Inc.",Real Estate,REIT - Specialty,178.57,60376125440,2337596928,0.016,Austin,TX,United States,3664,"Digital Realty brings companies and data together by delivering the full spectrum of data center, colocation, and interconnection solutions. PlatformDIGITAL, the company's global data center platform, provides customers with a secure data meeting place and a proven Pervasive Datacenter Architecture (PDx) solution methodology for powering innovation and efficiently managing Data Gravity challenges. Digital Realty gives its customers access to the connected data communities that matter to them with a global data center footprint of 300+ facilities in 50+ metros across 25+ countries on six continents.",0.001086242839199632
NYQ,TGT,Target Corporation,Target Corporation,Consumer Defensive,Discount Stores,131.48,60245712896,9230999552,0.027,Minneapolis,MN,United States,415000,"Target Corporation operates as a general merchandise retailer in the United States. The company offers apparel for women, men, boys, girls, toddlers, and infants and newborns, as well as jewelry, accessories, and shoes; and beauty and personal care, baby gear, cleaning, paper products, and pet supplies. It also provides dry grocery, dairy, frozen food, beverages, candy, snacks, deli, bakery, meat, and food service; electronics, which includes video game hardware and software, toys, entertainment, sporting goods, and luggage; and furniture, lighting, storage, kitchenware, small appliances, home decor, bed and bath, home improvement, school/office supplies, greeting cards and party supplies, and other seasonal merchandise. In addition, the company sells merchandise through periodic design and creative partnerships, and shop-in-shop experience; and in-store amenities. Further, it sells its products through its stores; and digital channels, including Target.com. Target Corporation was incorporated in 1902 and is headquartered in Minneapolis, Minnesota.",0.0010838965526330556
NYQ,GM,General Motors Company,General Motors Company,Consumer Cyclical,Auto Manufacturers,51.81,56970276864,18371000320,0.105,Detroit,MI,United States,163000,"General Motors Company designs, builds, and sells trucks, crossovers, cars, and automobile parts; and provide software-enabled services and subscriptions worldwide. The company operates through GM North America, GM International, Cruise, and GM Financial segments. It markets its vehicles primarily under the Buick, Cadillac, Chevrolet, GMC, Baojun, and Wuling brand names. In addition, the company sells trucks, crossovers, cars, and automobile parts through retail dealers, and distributors and dealers, as well as to fleet customers, including daily rental car companies, commercial fleet customers, leasing companies, and governments. Further, it offers range of after-sale services through dealer network, such as maintenance, light repairs, collision repairs, vehicle accessories, and extended service warranties. Additionally, the company provides automotive financing; and software-enabled services and subscriptions. General Motors Company was founded in 1908 and is headquartered in Detroit, Michigan.",0.0010249673167954194
NYQ,BK,The Bank of New York Mellon Cor,The Bank of New York Mellon Corporation,Financial Services,Banks - Diversified,77.62,56435798016,,0.047,New York,NY,United States,52600,"The Bank of New York Mellon Corporation provides a range of financial products and services in the United States and internationally. The company operates through Securities Services, Market and Wealth Services, Investment and Wealth Management, and other segments. The Securities Services segment offers custody, trust and depositary, accounting, exchange-traded funds, middle-office solutions, transfer agency, services for private equity and real estate funds, foreign exchange, securities lending, liquidity/lending services, and data analytics. This segment also provides trustee, paying agency, fiduciary, escrow and other financial, issuer, and support services for brokers and investors. The Market and Wealth Services segment offers clearing and custody, investment, wealth and retirement solutions, technology and enterprise data management, trading, and prime brokerage services. This segment also provides integrated cash management solutions, including payments, foreign exchange, liquidity management, receivables processing and payables management, and trade finance and processing services. The Investment and Wealth Management segment offers investment management strategies and distribution of investment products, investment management, custody, wealth and estate planning, private banking, investment, and information management services. The Other segment engages in the provision of leasing, corporate treasury, derivative and other trading, corporate and bank-owned life insurance, renewable energy investment, and business exit services. It serves central banks and sovereigns, financial institutions, asset managers, insurance companies, corporations, local authorities and high net-worth individuals, and family offices. The Bank of New York Mellon Corporation was founded in 1784 and is headquartered in New York, New York.",0.0010153513664986316
NMS,ROP,"Roper Technologies, Inc.","Roper Technologies, Inc.",Technology,Software - Application,525.4,56338120704,2732699904,0.129,Sarasota,FL,United States,16800,"Roper Technologies, Inc. designs and develops software, and technology enabled products and solutions. It operates through three segments: Application Software, Network Software, and Technology Enabled Products. The Application Software segment offers management, campus solutions, diagnostic and laboratory information management, enterprise software and information solutions, transportation management, financial and compliance management, and cloud-based financial analytics and performance management software; cloud-based software to the property and casualty insurance industry; and software, services, and technologies for foodservice operations. The Network Software segment provides cloud-based data, collaboration, and estimating automation software; electronic marketplace; visual effects and 3D content software; cloud-based software for the life insurance and financial services industries; supply chain software; health care service and software; data analytics and information; and pharmacy software solutions. The Technology Enabled Products segment offers ultrasound accessories; dispensers and metering pumps; wireless sensor network and solutions automated surgical scrub and linen dispensing equipment; water meters; optical and electromagnetic measurement systems; RFID card readers; and medical devices. It distributes and sells its products through direct sales, manufacturers' representatives, resellers, and distributors. The company was formerly known as Roper Industries, Inc. and changed its name to Roper Technologies, Inc. in April 2015. The company was incorporated in 1981 and is based in Sarasota, Florida.",0.001013594028147768
NYQ,CVS,CVS Health Corporation,CVS Health Corporation,Healthcare,Healthcare Plans,44.36,55823069184,14115000320,0.06,Woonsocket,RI,United States,219000,"CVS Health Corporation provides health solutions in the United States. It operates through Health Care Benefits, Health Services, and Pharmacy & Consumer Wellness segments. The Health Care Benefits segment offers traditional, voluntary, and consumer-directed health insurance products and related services. It serves employer groups, individuals, college students, part-time and hourly workers, health plans, health care providers, governmental units, government-sponsored plans, labor groups, and expatriates. The Health Services segment offers pharmacy benefit management solutions, including plan design and administration, formulary management, retail pharmacy network management, specialty and mail order pharmacy, clinical, disease management, and medical spend management services. It serves employers, insurance companies, unions, government employee groups, health plans, prescription drug plans, Medicaid managed care plans, CMS, plans offered on public health insurance, and other sponsors of health benefit plans. The Pharmacy & Consumer Wellness segment sells prescription and over-the-counter drugs, consumer health and beauty products, and personal care products. This segment also distributes prescription drugs; and provides related pharmacy consulting and other ancillary services to care facilities and other care settings. It operates online retail pharmacy websites, LTC pharmacies and on-site pharmacies, retail specialty pharmacy stores, compounding pharmacies and branches for infusion and enteral nutrition services. The company was formerly known as CVS Caremark Corporation and changed its name to CVS Health Corporation in September 2014. CVS Health Corporation was incorporated in 1996 and is headquartered in Woonsocket, Rhode Island.",0.0010043276000465664
NMS,PCAR,PACCAR Inc.,PACCAR Inc,Industrials,Farm & Heavy Construction Machinery,105.32,55219380224,5908100096,-0.052,Bellevue,WA,United States,32400,"PACCAR Inc designs, manufactures, and distributes light, medium, and heavy-duty commercial trucks in the United States, Canada, Europe, Mexico, South America, Australia, and internationally. It operates through three segments: Truck, Parts, and Financial Services. The Truck segment designs, manufactures, and distributes trucks for the over-the-road and off-highway hauling of commercial and consumer goods. It sells its trucks through a network of independent dealers under the Kenworth, Peterbilt, and DAF nameplates. The Parts segment distributes aftermarket parts for trucks and related commercial vehicles. The Financial Services segment conducts full-service leasing operations under the PacLease trade name, as well as provides finance and leasing products and services to customers and dealers. This segment also offers equipment financing and administrative support services for its franchisees; retail loan and leasing services for small, medium, and large commercial trucking companies, as well as independent owners/operators and other businesses; and truck inventory financing services to independent dealers. In addition, this segment offers loans and leases directly to customers for the acquisition of trucks and related equipment. The company also manufactures and markets industrial winches under the Braden, Carco, and Gearmatic nameplates. PACCAR Inc was founded in 1905 and is headquartered in Bellevue, Washington.",0.0009934664723222388
